{
  "$schema": "https://json-schema.org/draft/2020-12/schema",
  "$id": "https://schemas.kumwe.org/studio/v1/media-upload-session.schema.json",
  "title": "Studio media upload session",
  "type": "object",
  "additionalProperties": false,
  "required": ["contractVersion", "kind", "id", "request", "state", "progress"],
  "properties": {
    "contractVersion": { "$ref": "common.schema.json#/$defs/contractVersion" },
    "kind": { "const": "media-upload-session" },
    "id": { "$ref": "common.schema.json#/$defs/stableId" },
    "request": {
      "type": "object",
      "additionalProperties": false,
      "required": ["filename", "mediaType", "byteSize", "purpose"],
      "properties": {
        "filename": {
          "type": "string",
          "minLength": 1,
          "maxLength": 255,
          "pattern": "^[^\\u0000-\\u001F\\u007F/\\\\]+(?![\\s\\S])"
        },
        "mediaType": {
          "type": "string",
          "pattern": "^[a-z0-9][a-z0-9!#$&^_.+-]*/[a-z0-9][a-z0-9!#$&^_.+-]*(?![\\s\\S])",
          "maxLength": 120
        },
        "byteSize": { "type": "integer", "minimum": 1, "maximum": 1099511627776 },
        "purpose": { "$ref": "common.schema.json#/$defs/qualifiedName" },
        "checksum": { "$ref": "common.schema.json#/$defs/integrity" }
      }
    },
    "plan": { "$ref": "#/$defs/plan" },
    "state": {
      "enum": [
        "requested",
        "authorized",
        "transferring",
        "verifying",
        "complete",
        "failed",
        "cancelled"
      ]
    },
    "progress": {
      "type": "object",
      "additionalProperties": false,
      "required": ["transferredBytes", "totalBytes"],
      "properties": {
        "transferredBytes": { "type": "integer", "minimum": 0, "maximum": 1099511627776 },
        "totalBytes": { "type": "integer", "minimum": 0, "maximum": 1099511627776 }
      }
    },
    "asset": { "$ref": "#/$defs/acceptedAsset" },
    "failure": { "$ref": "common.schema.json#/$defs/diagnostic" }
  },
  "allOf": [
    {
      "if": { "properties": { "state": { "const": "complete" } }, "required": ["state"] },
      "then": {
        "properties": { "asset": { "$ref": "#/$defs/acceptedAsset" } },
        "required": ["asset"]
      }
    },
    {
      "if": { "properties": { "state": { "const": "failed" } }, "required": ["state"] },
      "then": {
        "properties": { "failure": { "$ref": "common.schema.json#/$defs/diagnostic" } },
        "required": ["failure"]
      }
    },
    {
      "if": {
        "properties": { "state": { "enum": ["authorized", "transferring", "verifying"] } },
        "required": ["state"]
      },
      "then": {
        "properties": { "plan": { "$ref": "#/$defs/plan" } },
        "required": ["plan"]
      }
    },
    {
      "if": { "properties": { "state": { "const": "requested" } }, "required": ["state"] },
      "then": { "not": { "required": ["asset"] } }
    }
  ],
  "$defs": {
    "acceptedAsset": {
      "type": "object",
      "additionalProperties": false,
      "required": ["id", "revision", "state"],
      "properties": {
        "id": { "$ref": "common.schema.json#/$defs/stableId" },
        "revision": { "$ref": "common.schema.json#/$defs/revision" },
        "state": { "enum": ["processing", "ready", "rejected", "quarantined"] }
      }
    },
    "plan": {
      "type": "object",
      "additionalProperties": false,
      "required": ["maximumBytes", "resumable"],
      "properties": {
        "maximumBytes": { "type": "integer", "minimum": 1, "maximum": 1099511627776 },
        "chunkBytes": { "type": "integer", "minimum": 1024, "maximum": 1073741824 },
        "resumable": { "type": "boolean" }
      }
    }
  }
}
