{
  "contractVersion": "0.1-draft",
  "kind": "media-upload-session",
  "id": "uploads/2b6f0d31",
  "request": {
    "filename": "trail-backpack-side.jpg",
    "mediaType": "image/jpeg",
    "byteSize": 3145728,
    "purpose": "org.example.catalog/product-gallery",
    "checksum": "sha256-47DEQpj8HBSa+/TImW+5JCeuQeRkm5NMpJWZG3hSuFU="
  },
  "plan": {
    "maximumBytes": 10485760,
    "chunkBytes": 1048576,
    "resumable": true
  },
  "state": "transferring",
  "progress": {
    "transferredBytes": 2097152,
    "totalBytes": 3145728
  }
}
